{
  "$schema": "https://json-schema.org/draft/2020-12/schema",
  "$id": "https://elabora.studio/schemas/0.1.8/narration-audio.schema.json",
  "title": "Narration audio of a line (assets/narration/<language>/<screen>/<line>.json)",
  "description": "What a voice tool or an import wrote next to the audio of one narration line in one language (assets/narration/<language>/<screen>/<line>.m4a): the text it was made from, its length and its voice. Written by tools (elabora narration import, the voice tools), read by the validator (missing or out-of-date audio) and the build. Never shipped in packages.",
  "type": "object",
  "additionalProperties": false,
  "required": ["screen", "line", "language", "textHash", "duration", "provider", "voice", "generated"],
  "properties": {
    "$schema": { "type": "string" },
    "screen": { "$ref": "defs.schema.json#/$defs/slug", "description": "The screen of the line." },
    "line": { "type": "string", "pattern": "^[a-z][a-z0-9-]{0,47}(\\.[a-z0-9]{1,8})?$", "description": "The line: its id (narration.lines[].id, a layer's or a dialogue's line), or <node>.<option> for an option a dialogue's learner says with their voice (learnerVoice)." },
    "language": { "$ref": "defs.schema.json#/$defs/language", "description": "The language spoken." },
    "textHash": {
      "type": "string",
      "pattern": "^sha256:[0-9a-f]{64}$",
      "description": "SHA-256 of the line's text in that language the audio was made from, after Unicode NFC, whitespace runs made one space and trimmed (narrationTextHash in @elabora/core). Another hash: the text changed since, the audio is out of date."
    },
    "duration": { "type": "number", "exclusiveMinimum": 0, "maximum": 600, "description": "Seconds of audio." },
    "provider": {
      "type": "string",
      "pattern": "^[a-z0-9][a-z0-9._-]{0,47}$",
      "description": "The voice tool that made it, or recording for a human voice."
    },
    "voice": { "type": "string", "maxLength": 120, "description": "The provider's id of the voice (may be empty for a recording)." },
    "generated": { "type": "boolean", "description": "A synthetic voice (AI Act, art. 50): the player and the proof dossier say so." },
    "audioHash": {
      "type": "string",
      "pattern": "^sha256:[0-9a-f]{64}$",
      "description": "SHA-256 of the audio file's bytes when this was written: another file in its place is out of date."
    },
    "createdAt": { "type": "string", "format": "date-time" },
    "take": { "type": "integer", "minimum": 1, "description": "Which take of a voice that says a line differently each time is in the course (the others stay in the tool's own data, never in assets/)." },
    "settingsHash": {
      "type": "string",
      "pattern": "^sha256:[0-9a-f]{64}$",
      "description": "Generated voices: SHA-256 of the canonical JSON of the settings it was made with (the speaker's voices[language].settings, with the line's delivery[language] over them). Other settings since: out of date."
    },
    "spokenHash": {
      "type": "string",
      "pattern": "^sha256:[0-9a-f]{64}$",
      "description": "Generated voices: hash of the text the voice was given, after the pronunciations of the line and of the course (spokenText in @elabora/core), normalised as textHash. Another pronunciation since: out of date."
    },
    "credit": { "type": "string", "minLength": 1, "maxLength": 400, "description": "What the module's credits say of this voice (the model, the voice and their licences, attribution a CC-BY voice requires). Builds list the distinct credits of a package." },
    "model": { "type": "string", "maxLength": 200, "description": "The model and its revision, for information: another model does not make the audio out of date." },
    "text": { "type": "string", "minLength": 1, "maxLength": 2000, "description": "The line's text in that language when the audio was made (its hash is textHash): once the line is out of date, editors quote the words the voice still says, and word anchors follow the words that stayed." },
    "aligner": { "type": "string", "maxLength": 200, "description": "What timed the words (the forced-alignment model and its revision, or the voice itself), for information." },
    "mouth": {
      "type": "string",
      "pattern": "^[csow]*$",
      "maxLength": 18000,
      "description": "How open a character's mouth is while the audio plays, one letter per 1/30 s from its start: c (closed), s (small), o (open), w (wide). Computed from the audio and its words when the audio is written or its words timed (the build computes it for a sidecar without it); the player's characters read it (docs/dialogues.md)."
    },
    "words": {
      "type": "array",
      "maxItems": 2000,
      "description": "When each word of text is said, in seconds from the start of the audio file, in the order of the text (the words of narrationWords in @elabora/core: elisions such as l' and qu' are words of their own): what word anchors resolve to. Written by forced alignment (elabora narration align) when a voice is generated or a recording imported.",
      "items": {
        "type": "object",
        "additionalProperties": false,
        "required": ["text", "start", "end"],
        "properties": {
          "text": { "type": "string", "minLength": 1, "maxLength": 200 },
          "start": { "type": "number", "minimum": 0 },
          "end": { "type": "number", "minimum": 0 },
          "score": { "type": "number", "minimum": 0, "maximum": 1, "description": "How sure the alignment is that the voice says this word (0 to 1): a word the voice swallowed scores low." }
        }
      }
    }
  }
}
