{
  "screen": "chemin",
  "line": "chemin-reseaux",
  "language": "fr",
  "textHash": "sha256:50109c0ea28f39403ea908a17bd0d7dac31aa3a3db376203bf5513c2f8e4b1fb",
  "duration": 8.823,
  "provider": "pocket-tts",
  "voice": "claire",
  "generated": true,
  "audioHash": "sha256:efc5b602f785a81854161eb4e885a59614d5e1c2ae95a2fca2a2723e344a7268",
  "createdAt": "2026-10-08T20:21:19Z",
  "take": 1,
  "spokenHash": "sha256:50109c0ea28f39403ea908a17bd0d7dac31aa3a3db376203bf5513c2f8e4b1fb",
  "settingsHash": "sha256:44136fa355b3678a1146ad16f7e8649e94fb4fc21fe77e8310c060f61caaff8a",
  "credit": "Voix de synthèse : Pocket TTS de Kyutai (Manu Orsini, Simon Rouard, Gabriel De Marmiesse, Václav Volhejn, Neil Zeghidour, Alexandre Défossez), https://huggingface.co/kyutai/pocket-tts, sous licence CC-BY 4.0 (https://creativecommons.org/licenses/by/4.0/), dans la conversion ONNX de KevinAHM. Voix « Claire » d’après un enregistrement du corpus CML-TTS (Frederico S. Oliveira, Edresson Casanova, Arnaldo Candido Junior, Anderson S. Soares, Arlindo R. Galvão Filho ; CEIA, Université fédérale de Goiás), https://openslr.org/146/, sous licence CC-BY 4.0 (https://creativecommons.org/licenses/by/4.0/) ; enregistrement nettoyé par Kyutai, puis transformé en voix de synthèse.",
  "model": "pocket-tts/french_24l@d29db79",
  "text": "Le routeur dirige ensuite les paquets vers le réseau des serveurs. Le pare-feu décide quels flux peuvent passer. Le serveur d'impression reçoit enfin la demande.",
  "aligner": "wav2vec2-large-xlsr-53-french@7c79e10 int8",
  "words": [
    {
      "text": "Le",
      "start": 0.1,
      "end": 0.214,
      "score": 0.999
    },
    {
      "text": "routeur",
      "start": 0.241,
      "end": 0.595,
      "score": 0.998
    },
    {
      "text": "dirige",
      "start": 0.622,
      "end": 0.997,
      "score": 0.968
    },
    {
      "text": "ensuite",
      "start": 1.003,
      "end": 1.324,
      "score": 0.966
    },
    {
      "text": "les",
      "start": 1.324,
      "end": 1.458,
      "score": 0.994
    },
    {
      "text": "paquets",
      "start": 1.464,
      "end": 1.839,
      "score": 0.999
    },
    {
      "text": "vers",
      "start": 1.845,
      "end": 1.985,
      "score": 0.997
    },
    {
      "text": "le",
      "start": 1.985,
      "end": 2.079,
      "score": 0.999
    },
    {
      "text": "réseau",
      "start": 2.106,
      "end": 2.346,
      "score": 0.998
    },
    {
      "text": "des",
      "start": 2.346,
      "end": 2.467,
      "score": 0.959
    },
    {
      "text": "serveurs",
      "start": 2.467,
      "end": 2.962,
      "score": 0.974
    },
    {
      "text": "Le",
      "start": 3.349,
      "end": 3.463,
      "score": 0.999
    },
    {
      "text": "pare-feu",
      "start": 3.469,
      "end": 3.804,
      "score": 0.837
    },
    {
      "text": "décide",
      "start": 3.81,
      "end": 4.145,
      "score": 1
    },
    {
      "text": "quels",
      "start": 4.151,
      "end": 4.412,
      "score": 0.975
    },
    {
      "text": "flux",
      "start": 4.412,
      "end": 4.632,
      "score": 0.925
    },
    {
      "text": "peuvent",
      "start": 4.632,
      "end": 4.853,
      "score": 0.984
    },
    {
      "text": "passer",
      "start": 4.853,
      "end": 5.188,
      "score": 1
    },
    {
      "text": "Le",
      "start": 6.517,
      "end": 6.631,
      "score": 0.999
    },
    {
      "text": "serveur",
      "start": 6.658,
      "end": 6.958,
      "score": 1
    },
    {
      "text": "d'",
      "start": 6.958,
      "end": 7.039,
      "score": 0.946
    },
    {
      "text": "impression",
      "start": 7.039,
      "end": 7.433,
      "score": 0.999
    },
    {
      "text": "reçoit",
      "start": 7.46,
      "end": 7.74,
      "score": 1
    },
    {
      "text": "enfin",
      "start": 7.74,
      "end": 7.935,
      "score": 1
    },
    {
      "text": "la",
      "start": 7.941,
      "end": 8.055,
      "score": 1
    },
    {
      "text": "demande",
      "start": 8.061,
      "end": 8.456,
      "score": 0.979
    }
  ]
}
