{
  "screen": "rules",
  "line": "l4",
  "language": "en",
  "textHash": "sha256:e4cd4669227fe8f49cccf9d9708c4bf32b8084517c9bb838427d56c45e0e21a6",
  "duration": 4.81,
  "provider": "elevenlabs",
  "voice": "CvD6hF1BJzAFN428j1cO",
  "generated": true,
  "audioHash": "sha256:e633f69553e1467e47ba95f2ff316929c9e2d42efdf03f8d50ef022ae2853bb9",
  "createdAt": "2026-10-23T12:18:40Z",
  "take": 1,
  "spokenHash": "sha256:e4cd4669227fe8f49cccf9d9708c4bf32b8084517c9bb838427d56c45e0e21a6",
  "settingsHash": "sha256:44136fa355b3678a1146ad16f7e8649e94fb4fc21fe77e8310c060f61caaff8a",
  "credit": "Synthetic voice: Kristen (ElevenLabs)",
  "model": "elevenlabs/eleven_v4",
  "text": "Monthly drills in 2025. And this module, today.",
  "aligner": "wav2vec2-base-960h@a19f851 quantized",
  "words": [
    {
      "text": "Monthly",
      "start": 0.06,
      "end": 0.541,
      "score": 0.97
    },
    {
      "text": "drills",
      "start": 0.541,
      "end": 1.074,
      "score": 0.966
    },
    {
      "text": "in",
      "start": 1.122,
      "end": 1.283,
      "score": 1
    },
    {
      "text": "2025",
      "start": 1.283,
      "end": 2.457,
      "score": 0.607
    },
    {
      "text": "And",
      "start": 3.066,
      "end": 3.227,
      "score": 1
    },
    {
      "text": "this",
      "start": 3.227,
      "end": 3.507,
      "score": 0.964
    },
    {
      "text": "module",
      "start": 3.507,
      "end": 4.02,
      "score": 0.973
    },
    {
      "text": "today",
      "start": 4.289,
      "end": 4.81,
      "score": 0.856
    }
  ]
}
