{
  "screen": "premier-reflexe",
  "line": "marc-soulage",
  "language": "fr",
  "textHash": "sha256:486e6cbd256a8e54520bfa169c8212e195d33c3c035595a848fda006511b65af",
  "duration": 3.1,
  "provider": "elevenlabs",
  "voice": "kENkNtk0xyzG09WW40xE",
  "generated": true,
  "audioHash": "sha256:51ea30f511f95dc2820c9b62de9583eff18606efe8698632af05105b49dfbb98",
  "createdAt": "2026-10-23T23:42:47Z",
  "take": 1,
  "spokenHash": "sha256:486e6cbd256a8e54520bfa169c8212e195d33c3c035595a848fda006511b65af",
  "settingsHash": "sha256:44136fa355b3678a1146ad16f7e8649e94fb4fc21fe77e8310c060f61caaff8a",
  "credit": "Voix de synthèse : Marcel (ElevenLabs)",
  "model": "elevenlabs/eleven_v4",
  "text": "[soulagé] D'accord. Au moins, je sais où vous en êtes.",
  "mouth": "ccccccccccccccwwwwccoooosscccccccccccccccccwwoocwwwwwwccccccccoooosssswwwsssssssoooooocccccccc",
  "aligner": "wav2vec2-large-xlsr-53-french@7c79e10 int8",
  "words": [
    {
      "text": "D'",
      "start": 0.463,
      "end": 0.524,
      "score": 0.5
    },
    {
      "text": "accord",
      "start": 0.524,
      "end": 0.879,
      "score": 1
    },
    {
      "text": "Au",
      "start": 1.45,
      "end": 1.544,
      "score": 1
    },
    {
      "text": "moins",
      "start": 1.55,
      "end": 1.785,
      "score": 0.999
    },
    {
      "text": "je",
      "start": 2.074,
      "end": 2.188,
      "score": 1
    },
    {
      "text": "sais",
      "start": 2.255,
      "end": 2.416,
      "score": 1
    },
    {
      "text": "où",
      "start": 2.416,
      "end": 2.496,
      "score": 1
    },
    {
      "text": "vous",
      "start": 2.496,
      "end": 2.671,
      "score": 0.995
    },
    {
      "text": "en",
      "start": 2.677,
      "end": 2.772,
      "score": 1
    },
    {
      "text": "êtes",
      "start": 2.818,
      "end": 3.033,
      "score": 0.992
    }
  ]
}
