{
  "screen": "accueil",
  "line": "marc-appel",
  "language": "fr",
  "textHash": "sha256:8b34ed9a2c09fd75bd7bf6498fe9ae28c8ed8fb1a3c998e4314a201ca50efc9c",
  "duration": 7.206,
  "provider": "pocket-tts",
  "voice": "henri",
  "generated": true,
  "audioHash": "sha256:b6bed17b0956ea67b7fb284a5b812807a59e2b1efdb05ab60c93107578aba5f8",
  "createdAt": "2026-10-08T20:21:43Z",
  "take": 1,
  "spokenHash": "sha256:8b34ed9a2c09fd75bd7bf6498fe9ae28c8ed8fb1a3c998e4314a201ca50efc9c",
  "settingsHash": "sha256:44136fa355b3678a1146ad16f7e8649e94fb4fc21fe77e8310c060f61caaff8a",
  "credit": "Voix de synthèse : Pocket TTS de Kyutai (Manu Orsini, Simon Rouard, Gabriel De Marmiesse, Václav Volhejn, Neil Zeghidour, Alexandre Défossez), https://huggingface.co/kyutai/pocket-tts, sous licence CC-BY 4.0 (https://creativecommons.org/licenses/by/4.0/), dans la conversion ONNX de KevinAHM. Voix « Henri » d’après un enregistrement de Kyutai (CC0), https://huggingface.co/kyutai/tts-voices.",
  "model": "pocket-tts/french_24l@d29db79",
  "text": "Bonjour, c'est Marc. J'ai lancé l'impression, mais aucune feuille ne sort. Pouvez-vous m'aider à trouver ce qui bloque ?",
  "aligner": "wav2vec2-large-xlsr-53-french@7c79e10 int8",
  "words": [
    {
      "text": "Bonjour",
      "start": 0.1,
      "end": 0.554,
      "score": 1
    },
    {
      "text": "c'",
      "start": 0.681,
      "end": 0.721,
      "score": 0.799
    },
    {
      "text": "est",
      "start": 0.721,
      "end": 0.875,
      "score": 0.962
    },
    {
      "text": "Marc",
      "start": 0.881,
      "end": 1.195,
      "score": 0.999
    },
    {
      "text": "J'",
      "start": 2.122,
      "end": 2.182,
      "score": 0.782
    },
    {
      "text": "ai",
      "start": 2.182,
      "end": 2.262,
      "score": 1
    },
    {
      "text": "lancé",
      "start": 2.262,
      "end": 2.536,
      "score": 1
    },
    {
      "text": "l'",
      "start": 2.562,
      "end": 2.602,
      "score": 0.86
    },
    {
      "text": "impression",
      "start": 2.602,
      "end": 3.036,
      "score": 0.999
    },
    {
      "text": "mais",
      "start": 3.383,
      "end": 3.557,
      "score": 0.979
    },
    {
      "text": "aucune",
      "start": 3.703,
      "end": 4.003,
      "score": 0.965
    },
    {
      "text": "feuille",
      "start": 4.003,
      "end": 4.243,
      "score": 0.992
    },
    {
      "text": "ne",
      "start": 4.243,
      "end": 4.357,
      "score": 1
    },
    {
      "text": "sort",
      "start": 4.403,
      "end": 4.718,
      "score": 1
    },
    {
      "text": "Pouvez-vous",
      "start": 5.624,
      "end": 6.025,
      "score": 0.963
    },
    {
      "text": "m'",
      "start": 6.025,
      "end": 6.105,
      "score": 0.851
    },
    {
      "text": "aider",
      "start": 6.105,
      "end": 6.305,
      "score": 1
    },
    {
      "text": "à",
      "start": 6.305,
      "end": 6.379,
      "score": 1
    },
    {
      "text": "trouver",
      "start": 6.385,
      "end": 6.665,
      "score": 1
    },
    {
      "text": "ce",
      "start": 6.665,
      "end": 6.745,
      "score": 0.998
    },
    {
      "text": "qui",
      "start": 6.745,
      "end": 6.865,
      "score": 0.998
    },
    {
      "text": "bloque",
      "start": 6.865,
      "end": 7.18,
      "score": 0.994
    }
  ]
}
